"Members – Detailed Hospitality Expenditures Report – Kmiec, Tom – Q2 2021"
Date,Location,Total of Attendees,Purpose of Hospitality,Type of Event,Claim,Supplier,Total
2020/07/01,Calgary,100,To celebrate a significant event,Hosting a reception or open house,M0243941,Good Earth Coffeehouse,754.0500
2020/07/13,Calgary,3,To meet constituents,Hosting a meeting,M0242453,Red's in Ramsay,81.3300
2020/08/15,Calgary,60,To meet constituents,Hosting a reception or open house,M0244909,Sobeys,9.6400
2020/08/15,Calgary,60,To meet constituents,Hosting a reception or open house,M0244909,Second Cup Cafe,240.0000
2020/09/01,Calgary,1,To discuss constituency issues with stakeholders,Hosting a meeting,M0246854,The Park Kitchen & Bar,50.5500
